{
  "schema_name": "phase2_timeline_output",
  "schema_version": "1.0",
  "section": "timeline_by_week",
  "book_title": "Trump Chronicles",
  "build": {
    "created_at": "2026-03-12T11:37:36Z",
    "created_by": "build_timeline_by_week.py",
    "model": null,
    "run_id": "timeline-20260312T113736Z-a6a7f478",
    "prompt_version": "metadata-only-v1",
    "git_commit": null
  },
  "generated_from": {
    "metadata_stack_pattern": "/Volumes/PRINTIFY24/Democracy Clock Automation/Step 3/Weeks/Week N/weekly_digest_metadata_stack_weekN.json",
    "weekly_spine_pattern": "/Volumes/PRINTIFY24/Democracy Clock Automation/Step 3/Weeks/Week N/weekly_digest_spine_weekN.json"
  },
  "entries": [
    {
      "week": 1,
      "start_date": "2025-01-20",
      "end_date": "2025-01-24",
      "date_display": "January 20–24, 2025",
      "chapter_title": "Trump’s Second Term Opens With a Wave of Orders and Pardons",
      "gloss": "The week opened with Donald Trump’s second inauguration and an immediate cascade of executive orders reshaping immigration, climate, civil rights, and federal institutions. He declared national emergencies at the southern border and in energy policy, ordered troop deployments, suspended asylum and refugee programs, and moved to end birthright citizenship—prompting swift lawsuits and temporary blocks from federal judges. Trump also withdrew the United States from the Paris climate agreement and the World Health Organization, cut or paused foreign aid, and dismantled federal diversity and equity programs while redefining gender in law. At home, he re‑implemented Schedule F to politicize the civil service, fired inspectors general and senior security officials, and created new White House‑centric structures like the Department of Government Efficiency. Most dramatically, he issued sweeping pardons for more than 1,500 January 6 defendants and anti‑abortion activists, while House Republicans formed a new January 6 panel to revisit the attack. States, unions, and advocacy groups began mounting legal and political resistance, even as routine regulatory work and some pro‑labor and industrial policies continued in the background.",
      "source_priority_used": "metadata.week_summary",
      "source_metadata_stack": "/Volumes/PRINTIFY24/Democracy Clock Automation/Step 3/Weeks/Week 1/weekly_digest_metadata_stack_week1.json",
      "source_weekly_spine": null
    },
    {
      "week": 2,
      "start_date": "2025-01-25",
      "end_date": "2025-01-31",
      "date_display": "January 25–31, 2025",
      "chapter_title": "Pardons, Purges, and a Funding Freeze",
      "gloss": "Across seven days, the administration used executive power to reshape core institutions while testing the limits of law and precedent. Trump issued mass pardons for January 6 offenders, dismantled diversity and civil-rights infrastructure, and moved to end birthright citizenship, even as federal courts temporarily blocked some of the most sweeping changes. Immigration enforcement escalated sharply, from ICE quotas and raids in schools and churches to plans for a 30,000-person migrant facility at Guantánamo Bay and the use of trade pressure to force other countries to accept deportees. Inside government, watchdogs and prosecutors were fired, civil servants were pushed toward resignation, and key agencies like DOJ, FBI, NLRB, EEOC, EPA, and HHS saw their independence eroded. A short-lived freeze on trillions in federal grants and loans disrupted Medicaid and other services before judges intervened and the White House retreated. At the same time, information and history were aggressively curated—climate and DEI content removed, public media probed, and civic education steered toward a narrow, patriotic line—while states, advocacy groups, and some courts mounted early resistance.",
      "source_priority_used": "metadata.week_summary",
      "source_metadata_stack": "/Volumes/PRINTIFY24/Democracy Clock Automation/Step 3/Weeks/Week 2/weekly_digest_metadata_stack_week2.json",
      "source_weekly_spine": null
    },
    {
      "week": 3,
      "start_date": "2025-02-01",
      "end_date": "2025-02-07",
      "date_display": "February 1–7, 2025",
      "chapter_title": "Foreign Aid Seized, Justice Purged, and Private Power Inside the State",
      "gloss": "Across seven days, the administration moved aggressively to centralize power, outsource core state functions, and redraw the boundaries of rights at home and abroad. Foreign aid was frozen and USAID effectively shuttered as the White House sought to fold it into the State Department, even as Trump announced withdrawals from UN human rights bodies and sanctions on the International Criminal Court. Sweeping tariffs on Canada, Mexico, and China were imposed, paused, and repurposed as bargaining chips, rattling markets and allies. Inside the government, Elon Musk’s “efficiency” team gained deep access to Treasury payment systems and federal personnel databases, while a mass “deferred resignation” offer aimed to thin the civil service. At the Justice Department and FBI, purges and structural changes weakened corruption and foreign‑influence enforcement, even as courts temporarily blocked some of the most extreme orders, including attempts to end birthright citizenship and strip protections from transgender prisoners. Civil society, state governments, and protesters began to organize legal and political resistance to these overlapping campaigns.",
      "source_priority_used": "metadata.week_summary",
      "source_metadata_stack": "/Volumes/PRINTIFY24/Democracy Clock Automation/Step 3/Weeks/Week 3/weekly_digest_metadata_stack_week3.json",
      "source_weekly_spine": null
    },
    {
      "week": 4,
      "start_date": "2025-02-08",
      "end_date": "2025-02-14",
      "date_display": "February 8–14, 2025",
      "chapter_title": "Courts Push Back as Trump and Musk Reshape the State",
      "gloss": "Across this week, the Trump administration and its ally Elon Musk accelerated efforts to centralize power in the executive branch, dismantle parts of the civil service, and rewrite the informational landscape of government. DOGE, the repurposed U.S. Digital Service, moved deeper into core state functions—cutting science budgets, targeting Social Security and consumer protection, and even probing Pentagon spending—while courts repeatedly intervened to block funding freezes, mass sidelining of USAID staff, and attempts to cap NIH research support. Immigration enforcement hardened at home, with raids, school and jail access for ICE, and lawsuits against sanctuary policies, even as judges temporarily protected immigrants from Guantanamo transfers and preserved birthright citizenship. Information control became a parallel front: agencies scrubbed DEI and LGBTQ content, Pentagon schools pulled books, and the National Park Service rewrote Stonewall’s history, while Musk’s team published classified data and gained sweeping access to federal personnel files. At the same time, public and institutional pushback—from jammed congressional phone lines to lawsuits by states, inspectors general, and school districts—kept the week from being a one-way consolidation of power.",
      "source_priority_used": "metadata.week_summary",
      "source_metadata_stack": "/Volumes/PRINTIFY24/Democracy Clock Automation/Step 3/Weeks/Week 4/weekly_digest_metadata_stack_week4.json",
      "source_weekly_spine": null
    },
    {
      "week": 5,
      "start_date": "2025-02-15",
      "end_date": "2025-02-21",
      "date_display": "February 15–21, 2025",
      "chapter_title": "Mass Firings, Data Grabs, and Third-Term Talk",
      "gloss": "Across the week, the administration moved aggressively to shrink and reshape the federal state. Mass firings and furloughs swept through health, safety, environmental, foreign aid, and land-management agencies, often targeting probationary staff and even veterans, while courts mostly declined to halt the purge. Elon Musk’s DOGE operation deepened its reach into sensitive IRS, Social Security, and other federal data systems, prompting resignations, lawsuits, and urgent oversight letters from Congress. At the Justice Department, political directives to drop the Eric Adams corruption case and to fire Biden-era U.S. attorneys triggered high-level resignations and judicial scrutiny. Immigration policy hardened through new benefit restrictions and a Senate-funded mass deportation plan. In parallel, the administration escalated efforts to control information and culture—banning the Associated Press, censoring military school curricula, erasing LGBTQ+ and Black history from federal sites, cutting climate research, and fast-tracking fossil fuel projects. By week’s end, talk of a possible third Trump term and celebratory treatment of January 6 offenders underscored mounting pressure on constitutional norms.",
      "source_priority_used": "metadata.week_summary",
      "source_metadata_stack": "/Volumes/PRINTIFY24/Democracy Clock Automation/Step 3/Weeks/Week 5/weekly_digest_metadata_stack_week5.json",
      "source_weekly_spine": null
    },
    {
      "week": 6,
      "start_date": "2025-02-22",
      "end_date": "2025-02-28",
      "date_display": "February 22–28, 2025",
      "chapter_title": "Mass Pardons, Mass Layoffs, and the Battle Over Who Controls the State",